{
  "$schema": "https://json-schema.org/draft/2020-12/schema",
  "$id": "https://aoa.local/schemas/federation_route_decision_v1.json",
  "title": "federation_route_decision_v1",
  "type": "object",
  "required": [
    "schema_version",
    "kind",
    "id",
    "status",
    "summary",
    "evidence_refs",
    "payload",
    "owner_repo"
  ],
  "properties": {
    "schema_version": {
      "type": "string",
      "const": "1.0"
    },
    "kind": {
      "type": "string",
      "const": "federation_route_decision"
    },
    "id": {
      "type": "string",
      "minLength": 3
    },
    "status": {
      "type": "string",
      "enum": [
        "draft",
        "captured",
        "candidate",
        "review",
        "approved",
        "blocked",
        "rejected",
        "promoted",
        "active",
        "retired",
        "scheduled",
        "passed",
        "failed"
      ]
    },
    "summary": {
      "type": "string",
      "minLength": 1
    },
    "owner_repo": {
      "type": "string",
      "const": "aoa-routing"
    },
    "evidence_refs": {
      "type": "array",
      "items": {
        "type": "string",
        "minLength": 1
      },
      "minItems": 1
    },
    "payload": {
      "type": "object",
      "required": [
        "decision",
        "owner_repo",
        "reason"
      ],
      "additionalProperties": false,
      "properties": {
        "decision": {
          "type": "string",
          "enum": [
            "route_to_owner",
            "route_to_source_owner",
            "route_to_owner_review",
            "route_to_local_landing"
          ]
        },
        "owner_repo": {
          "type": "string",
          "const": "aoa-routing"
        },
        "reason": {
          "type": "string"
        }
      }
    }
  },
  "additionalProperties": false
}
